{
  "schema_version": "commercial_copy.v1",
  "copy_id": "faucet-filter-indonesia-copy-result-first-blocked-v1",
  "context": {
    "market": "INDONESIA",
    "language": "id-ID",
    "platform": "TIKTOK",
    "platform_source": "DECLARED"
  },
  "strategy": {
    "ref": "examples/strategy/indonesia-faucet-filter-abc.json",
    "sha256": "66d60ff75388871fa75be322af9e5f2bf112d77f178cc944f31bc218576d742d",
    "variant_id": "C"
  },
  "boundaries": {
    "product_facts": {
      "ref": "brief/product_facts.json",
      "sha256": "1111111111111111111111111111111111111111111111111111111111111111"
    },
    "visual_evidence_boundary": {
      "ref": "evidence/visual-evidence-boundary.json",
      "sha256": "2222222222222222222222222222222222222222222222222222222222222222"
    }
  },
  "segments": [],
  "semantic_back_check": {
    "findings": []
  },
  "blocking": [
    {
      "segment_id": null,
      "reason_code": "STRATEGY_NOT_EXECUTABLE",
      "reason": "The requested result-first opening cannot be executed from the selected variant: variant C is a product-in-action demonstration and its claims_used contains no result claim.",
      "claim_ref": null,
      "missing": [
        "a strategy variant that authorises a filtration-result claim before a copy is written for one"
      ],
      "return_to": "COMMERCIAL_STRATEGY"
    },
    {
      "segment_id": null,
      "reason_code": "CLAIM_FORBIDDEN_BY_BOUNDARY",
      "reason": "A before/after filtration result is forbidden by the bound claim boundary, so no copy may open on it.",
      "claim_ref": "CLAIM-BEFORE-AFTER-FILTRATION-RESULT",
      "missing": [
        "a permitted product-performance fact that would let the ban be reconsidered"
      ],
      "return_to": "CLAIM_BOUNDARY"
    },
    {
      "segment_id": null,
      "reason_code": "REQUIRED_EVIDENCE_ABSENT",
      "reason": "The pool contains no footage of the water before and after filtration, and none of the visible areas the boundary marks PRESENT shows a filtration result.",
      "claim_ref": null,
      "missing": [
        "footage showing the water before and after filtration",
        "a permitted product-performance fact for the filter"
      ],
      "return_to": "VISUAL_EVIDENCE"
    }
  ],
  "status": "BLOCKED",
  "provenance": {
    "authoring_mode": "AGENT_AUTHORED",
    "authored_by": {
      "actor": "CODEX_SUPERVISOR",
      "producer_id": "commercial-copy-author"
    },
    "skill": {
      "name": "commercial-copy",
      "version": "1.0.0"
    },
    "validation": {
      "validator": "commercial_copy.validate_commercial_copy"
    },
    "based_on": [
      {
        "ref": "examples/strategy/indonesia-faucet-filter-abc.json",
        "sha256": "66d60ff75388871fa75be322af9e5f2bf112d77f178cc944f31bc218576d742d"
      },
      {
        "ref": "brief/product_facts.json",
        "sha256": "1111111111111111111111111111111111111111111111111111111111111111"
      },
      {
        "ref": "evidence/visual-evidence-boundary.json",
        "sha256": "2222222222222222222222222222222222222222222222222222222222222222"
      }
    ]
  }
}
