{
  "schema_version": "commercial_copy.v1",
  "copy_id": "faucet-filter-indonesia-copy-c-v1",
  "context": {
    "market": "INDONESIA",
    "language": "id-ID",
    "platform": "TIKTOK",
    "platform_source": "DECLARED"
  },
  "strategy": {
    "ref": "examples/strategy/indonesia-faucet-filter-abc.json",
    "sha256": "66d60ff75388871fa75be322af9e5f2bf112d77f178cc944f31bc218576d742d",
    "variant_id": "C"
  },
  "boundaries": {
    "product_facts": {
      "ref": "brief/product_facts.json",
      "sha256": "1111111111111111111111111111111111111111111111111111111111111111"
    },
    "visual_evidence_boundary": {
      "ref": "evidence/visual-evidence-boundary.json",
      "sha256": "2222222222222222222222222222222222222222222222222222222222222222"
    }
  },
  "segments": [
    {
      "segment_id": "C01",
      "copy_job": "VISUAL_ACTION_HOOK",
      "delivery": "DESIGNED_SILENCE",
      "semantic_intent": "Let the visible fitting action carry the opening with no voice-over. The demonstration is of the product working in place, not of a change to the water.",
      "claim_refs": [],
      "evidence_refs": ["EV-INSTALLATION"],
      "budget": {
        "target_seconds": 1.5,
        "acceptable_min_seconds": 1.2,
        "acceptable_max_seconds": 1.9
      },
      "localized": null,
      "designed_silence": {
        "reason": "The opening is carried by the fitting action; a line over it would compete with the demonstration.",
        "bed_note": "The tap, water and kitchen sound already in the footage continue under this segment; the voice is absent, the track is not."
      }
    },
    {
      "segment_id": "C02",
      "copy_job": "INSTALLATION",
      "delivery": "SPEECH",
      "semantic_intent": "Name what the opening just showed: it is fitted by hand at the tap. Describe no tools, no effort and no duration.",
      "claim_refs": ["CLAIM-SIMPLE-TO-INSTALL"],
      "evidence_refs": ["EV-INSTALLATION"],
      "budget": {
        "target_seconds": 2.3,
        "acceptable_min_seconds": 1.9,
        "acceptable_max_seconds": 2.8
      },
      "localized": {
        "language": "id-ID",
        "line": "Filter ini dipasang dengan tangan di ujung keran."
      },
      "designed_silence": null
    },
    {
      "segment_id": "C03",
      "copy_job": "VISIBLE_STRUCTURE",
      "delivery": "SPEECH",
      "semantic_intent": "Point at the transparent housing and the part inside it. Say nothing about what the part does to the water.",
      "claim_refs": ["CLAIM-STRUCTURE-IS-VISIBLE"],
      "evidence_refs": ["EV-STRUCTURE-VISIBLE"],
      "budget": {
        "target_seconds": 2.3,
        "acceptable_min_seconds": 1.9,
        "acceptable_max_seconds": 2.8
      },
      "localized": {
        "language": "id-ID",
        "line": "Rumah transparannya memperlihatkan bagian dalam filter."
      },
      "designed_silence": null
    },
    {
      "segment_id": "C04",
      "copy_job": "DAILY_USE",
      "delivery": "SPEECH",
      "semantic_intent": "Say the fitted filter is used in ordinary daily kitchen activity, and make no statement about the water itself.",
      "claim_refs": ["CLAIM-FITS-DAILY-KITCHEN-USE"],
      "evidence_refs": ["EV-DAILY-USAGE"],
      "budget": {
        "target_seconds": 2.2,
        "acceptable_min_seconds": 1.8,
        "acceptable_max_seconds": 2.6
      },
      "localized": {
        "language": "id-ID",
        "line": "Dipakai seperti biasa di dapur."
      },
      "designed_silence": null
    },
    {
      "segment_id": "C05",
      "copy_job": "CTA",
      "delivery": "SPEECH",
      "semantic_intent": "Send the buyer to the product page on the strength of what was just shown. Imply no filtration or water-safety outcome.",
      "claim_refs": [],
      "evidence_refs": [],
      "budget": {
        "target_seconds": 1.7,
        "acceptable_min_seconds": 1.4,
        "acceptable_max_seconds": 2.1
      },
      "localized": {
        "language": "id-ID",
        "line": "Lihat halaman produknya."
      },
      "designed_silence": null
    }
  ],
  "semantic_back_check": {
    "findings": [
      {
        "segment_id": "C02",
        "adds_claim": false,
        "expands_claim": false,
        "drops_qualifier": false,
        "possibility_as_certainty": false,
        "unauthorised_product_fact": false,
        "detail": null,
        "verdict": "PASS"
      },
      {
        "segment_id": "C03",
        "adds_claim": false,
        "expands_claim": false,
        "drops_qualifier": false,
        "possibility_as_certainty": false,
        "unauthorised_product_fact": false,
        "detail": null,
        "verdict": "PASS"
      },
      {
        "segment_id": "C04",
        "adds_claim": false,
        "expands_claim": false,
        "drops_qualifier": false,
        "possibility_as_certainty": false,
        "unauthorised_product_fact": false,
        "detail": null,
        "verdict": "PASS"
      },
      {
        "segment_id": "C05",
        "adds_claim": false,
        "expands_claim": false,
        "drops_qualifier": false,
        "possibility_as_certainty": false,
        "unauthorised_product_fact": false,
        "detail": null,
        "verdict": "PASS"
      }
    ]
  },
  "blocking": [],
  "status": "READY",
  "provenance": {
    "authoring_mode": "AGENT_AUTHORED",
    "authored_by": {
      "actor": "CODEX_SUPERVISOR",
      "producer_id": "commercial-copy-author"
    },
    "skill": {
      "name": "commercial-copy",
      "version": "1.0.0"
    },
    "validation": {
      "validator": "commercial_copy.validate_commercial_copy"
    },
    "based_on": [
      {
        "ref": "examples/strategy/indonesia-faucet-filter-abc.json",
        "sha256": "66d60ff75388871fa75be322af9e5f2bf112d77f178cc944f31bc218576d742d"
      },
      {
        "ref": "brief/product_facts.json",
        "sha256": "1111111111111111111111111111111111111111111111111111111111111111"
      },
      {
        "ref": "evidence/visual-evidence-boundary.json",
        "sha256": "2222222222222222222222222222222222222222222222222222222222222222"
      }
    ]
  }
}
